### ISSUE TITLE
IP Roaming not working when using boringtun as a client

### ISSUE THREAD

**Issue by DavidVentura** [cloudflare/boringtun#187]
Hi!
I think IP roaming is not working when using boringtun as a client.

My setup:

Client: 2 public IP
Server: 1 public IP

Working: wireguard-go:

When `client` brings down its primary interface, IP packets (with new source) arrive at `server` and the `wg` interface on `server` sees the data. The tunnel works.

Not working: boringtun:

After bringing down one of the interfaces on the client, the IP packets still arrive at `server` (with new source) but they never reach the `wg` interface

tcpdumps:

wireguard-go
```
21:17:10.530997 IP (tos 0x88, ttl 64, id 35409, offset 0, flags [none], proto UDP (17), length 176)
    SERVER_IP.5111 > CLIENT_IP_1.44533: UDP, length 148
21:17:15.651151 IP (tos 0x88, ttl 64, id 36627, offset 0, flags [none], proto UDP (17), length 176)
    SERVER_IP.5111 > CLIENT_IP_1.44533: UDP, length 148      
21:17:21.027013 IP (tos 0x88, ttl 64, id 36726, offset 0, flags [none], proto UDP (17), length 176)
    SERVER_IP.5111 > CLIENT_IP_1.44533: UDP, length 148      
```
```
21:24:09.510597 IP (tos 0x0, ttl 46, id 30474, offset 0, flags [DF], proto UDP (17), length 176)
    CLIENT_IP_2.18773 > SERVER_IP.5111: UDP, length 148     
21:24:09.511584 IP (tos 0x88, ttl 64, id 4658, offset 0, flags [none], proto UDP (17), length 120)
    SERVER_IP.5111 > CLIENT_IP_2.18773: UDP, length 92     
21:24:09.561596 IP (tos 0x0, ttl 47, id 30547, offset 0, flags [DF], proto UDP (17), length 60)
    CLIENT_IP_2.18773 > SERVER_IP.5111: UDP, length 32     
```

(packets still arrive at wg0)
```
21:23:26.932299 IP 10.88.88.6 > 10.88.88.10: ICMP echo request, id 627, seq 3, length 64
21:23:26.932353 IP 10.88.88.10 > 10.88.88.6: ICMP echo reply, id 627, seq 3, length 64
21:23:27.917045 IP 10.88.88.6 > 10.88.88.10: ICMP echo request, id 627, seq 4, length 64
21:23:27.917082 IP 10.88.88.10 > 10.88.88.6: ICMP echo reply, id 627, seq 4, length 64
21:23:28.919735 IP 10.88.88.6 > 10.88.88.10: ICMP echo request, id 627, seq 5, length 64
21:23:28.919804 IP 10.88.88.10 > 10.88.88.6: ICMP echo reply, id 627, seq 5, length 64
```

boringtun:

boring

```
21:25:10.332403 IP (tos 0x0, ttl 53, id 62924, offset 0, flags [DF], proto UDP (17), length 176)
    CLIENT_IP_1.49039 > SERVER_IP.5111: UDP, length 148      
21:25:10.333818 IP (tos 0x88, ttl 64, id 5045, offset 0, flags [none], proto UDP (17), length 120)
    SERVER_IP.5111 > CLIENT_IP_1.49039: UDP, length 92      
21:25:10.354439 IP (tos 0x0, ttl 53, id 62928, offset 0, flags [DF], proto UDP (17), length 60)
    CLIENT_IP_1.49039 > SERVER_IP.5111: UDP, length 32      
21:25:10.355012 IP (tos 0x0, ttl 53, id 62929, offset 0, flags [DF], proto UDP (17), length 144)
    CLIENT_IP_1.49039 > SERVER_IP.5111: UDP, length 116      
```
(packets still arrive at wg0)
```
21:25:30.745984 IP (tos 0x0, ttl 47, id 38302, offset 0, flags [DF], proto UDP (17), length 176)
    CLIENT_IP_2.17551 > SERVER_IP.5111: UDP, length 148
21:25:30.748415 IP (tos 0x88, ttl 64, id 10733, offset 0, flags [none], proto UDP (17), length 120)
    SERVER_IP.5111 > CLIENT_IP_2.17551: UDP, length 92
21:25:30.794701 IP (tos 0x0, ttl 48, id 38312, offset 0, flags [DF], proto UDP (17), length 60)
    CLIENT_IP_2.17551 > SERVER_IP.5111: UDP, length 32
```
(packets no longer arrive at wg0)

**Comment by DavidVentura** [comment]
And now in unified logs:

wireguard-go, working
```
go
root@debian-2gb-fsn1-dc8-1 ~ # tcpdump -i any -n  '(port 5111) or (net 10.88.88.0/24)'
tcpdump: verbose output suppressed, use -v or -vv for full protocol decode
listening on any, link-type LINUX_SLL (Linux cooked), capture size 262144 bytes
22:21:25.741230 IP CLIENT_IP_1.44533 > SERVER_IP.5111: UDP, length 32      
22:21:30.742877 IP CLIENT_IP_1.44533 > SERVER_IP.5111: UDP, length 32
22:21:30.790801 IP CLIENT_IP_1.44533 > SERVER_IP.5111: UDP, length 128
22:21:30.791115 IP 10.88.88.6 > 10.88.88.10: ICMP echo request, id 14217, seq 1, length 64
22:21:30.791159 IP 10.88.88.10 > 10.88.88.6: ICMP echo reply, id 14217, seq 1, length 64
22:21:30.791519 IP SERVER_IP.5111 > CLIENT_IP_1.44533: UDP, length 128
22:21:31.797312 IP CLIENT_IP_1.44533 > SERVER_IP.5111: UDP, length 128
22:21:31.797615 IP 10.88.88.6 > 10.88.88.10: ICMP echo request, id 14217, seq 2, length 64
22:21:31.797653 IP 10.88.88.10 > 10.88.88.6: ICMP echo reply, id 14217, seq 2, length 64
22:21:31.797724 IP SERVER_IP.5111 > CLIENT_IP_1.44533: UDP, length 128

root@debian-2gb-fsn1-dc8-1 ~ # tcpdump -i any -n  '(port 5111) or (net 10.88.88.0/24)'
tcpdump: verbose output suppressed, use -v or -vv for full protocol decode
listening on any, link-type LINUX_SLL (Linux cooked), capture size 262144 bytes
22:22:20.428581 IP CLIENT_IP_2.17493 > SERVER_IP.5111: UDP, length 148
22:22:20.430308 IP SERVER_IP.5111 > CLIENT_IP_2.17493: UDP, length 92
22:22:20.497360 IP CLIENT_IP_2.17493 > SERVER_IP.5111: UDP, length 32
22:22:22.565500 IP CLIENT_IP_2.17493 > SERVER_IP.5111: UDP, length 128
22:22:22.565850 IP 10.88.88.6 > 10.88.88.10: ICMP echo request, id 14473, seq 1, length 64
22:22:22.565919 IP 10.88.88.10 > 10.88.88.6: ICMP echo reply, id 14473, seq 1, length 64
22:22:22.566035 IP SERVER_IP.5111 > CLIENT_IP_2.17493: UDP, length 128
22:22:23.583448 IP CLIENT_IP_2.17493 > SERVER_IP.5111: UDP, length 128
22:22:23.583808 IP 10.88.88.6 > 10.88.88.10: ICMP echo request, id 14473, seq 2, length 64
22:22:23.583853 IP 10.88.88.10 > 10.88.88.6: ICMP echo reply, id 14473, seq 2, length 64
22:22:23.583981 IP SERVER_IP.5111 > CLIENT_IP_2.17493: UDP, length 128
22:22:24.594406 IP CLIENT_IP_2.17493 > SERVER_IP.5111: UDP, length 128
22:22:24.594856 IP 10.88.88.6 > 10.88.88.10: ICMP echo request, id 14473, seq 3, length 64
22:22:24.594899 IP 10.88.88.10 > 10.88.88.6: ICMP echo reply, id 14473, seq 3, length 64
```

boringtun, broken
```
root@debian-2gb-fsn1-dc8-1 ~ # tcpdump -i any -n  '(port 5111) or (net 10.88.88.0/24)'
tcpdump: verbose output suppressed, use -v or -vv for full protocol decode
listening on any, link-type LINUX_SLL (Linux cooked), capture size 262144 bytes
22:17:27.661740 IP CLIENT_IP_1.49039 > SERVER_IP.5111: UDP, length 116
22:17:27.662458 IP 10.88.88.6 > 10.88.88.10: ICMP echo request, id 12136, seq 1, length 64
22:17:27.662529 IP 10.88.88.10 > 10.88.88.6: ICMP echo reply, id 12136, seq 1, length 64
22:17:27.662582 IP SERVER_IP.5111 > CLIENT_IP_1.49039: UDP, length 128
22:17:27.662858 IP SERVER_IP.5111 > CLIENT_IP_1.49039: UDP, length 148
22:17:27.683868 IP CLIENT_IP_1.49039 > SERVER_IP.5111: UDP, length 92
22:17:27.684156 IP SERVER_IP.5111 > CLIENT_IP_1.49039: UDP, length 32
22:17:28.663070 IP CLIENT_IP_1.49039 > SERVER_IP.5111: UDP, length 116
22:17:28.663780 IP 10.88.88.6 > 10.88.88.10: ICMP echo request, id 12136, seq 2, length 64
22:17:28.663827 IP 10.88.88.10 > 10.88.88.6: ICMP echo reply, id 12136, seq 2, length 64
22:17:28.663866 IP SERVER_IP.5111 > CLIENT_IP_1.49039: UDP, length 128
22:17:29.667116 IP CLIENT_IP_1.49039 > SERVER_IP.5111: UDP, length 116
22:17:29.667619 IP 10.88.88.6 > 10.88.88.10: ICMP echo request, id 12136, seq 3, length 64
22:17:29.667663 IP 10.88.88.10 > 10.88.88.6: ICMP echo reply, id 12136, seq 3, length 64
22:17:29.667767 IP SERVER_IP.5111 > CLIENT_IP_1.49039: UDP, length 128
22:17:30.670181 IP CLIENT_IP_1.49039 > SERVER_IP.5111: UDP, length 116
22:17:30.670853 IP 10.88.88.6 > 10.88.88.10: ICMP echo request, id 12136, seq 4, length 64
22:17:30.670897 IP 10.88.88.10 > 10.88.88.6: ICMP echo reply, id 12136, seq 4, length 64
22:17:30.670938 IP SERVER_IP.5111 > CLIENT_IP_1.49039: UDP, length 128


root@debian-2gb-fsn1-dc8-1 ~ # tcpdump -i any -n  '(port 5111) or (net 10.88.88.0/24)'
tcpdump: verbose output suppressed, use -v or -vv for full protocol decode
listening on any, link-type LINUX_SLL (Linux cooked), capture size 262144 bytes
22:17:46.912084 IP CLIENT_IP_2.18223 > SERVER_IP.5111: UDP, length 148      
22:17:46.913613 IP SERVER_IP.5111 > CLIENT_IP_2.18223: UDP, length 92      
22:17:46.953998 IP CLIENT_IP_2.18223 > SERVER_IP.5111: UDP, length 32      
22:18:01.985137 IP CLIENT_IP_2.18223 > SERVER_IP.5111: UDP, length 148      
22:18:01.986236 IP SERVER_IP.5111 > CLIENT_IP_2.18223: UDP, length 92      
22:18:02.041946 IP CLIENT_IP_2.18223 > SERVER_IP.5111: UDP, length 32   
```

the _only_ difference between these two is the client. same device, kernel, server and network configuration

**Comment by marcbrevoort-cyberhive** [comment]
I can confirm this behaviour occurs for me as well. Restarting the vpn restores connectivity, but this shouldn't be necessary. Any idea what could be causing this?
